File,Key,CultureInvariantString,Translation
Everlasting_summer\Content\main\звуки\пролог\Me_96.json,8227635248B3FEC0097779945A4A4393,"Плати мне за это деньги, я бы обрадовался (да и заработал неплохо), но вряд ли так просто можно заполнить пустоту в душе.",如果干那个能拿工资的话，我可能会生活得幸福一些(也不会这么拮据)，不过恐怕还是难以填补我内心的空虚。
Everlasting_summer\Content\main\звуки\пролог\Me_97.json,3382D2434E31181CCE4C9E80D1C9405E,Сегодня очередной типичный день моей типичной жизни типичного неудачника(важное),今天又是典型的失败者的典型的一天。(важное)
Everlasting_summer\Content\main\звуки\пролог\Me_98.json,247EC56D42AF5FADFB10DA9C30C22497,И именно сегодня мне нужно ехать на встречу институтских товарищей(важное),而今天还是我大学同学聚会的日子。(важное)
Everlasting_summer\Content\main\звуки\пролог\Me_99.json,343F833E430C4A1E51B3FE956BBEEB6A,"По правде говоря, совершенно не хотелось.(важное)",说实话，我真的不想去。(важное)
Everlasting_summer\Content\main\звуки\пролог\Me_100.json,0CE416AF44DB7F745A7953BCC6A772FC,"Да и какой смысл, если вместе с ними я отучился всего ничего?",有什么意义呢，我跟他们相处的时间那么短。
Everlasting_summer\Content\main\звуки\пролог\Me_101.json,CABAE5094E4A11902CE086A15A67BB5E,"Однако меня всё же уговорил друг, бывший одногруппник, один из немногих, с кем я поддерживал контакт не только в интернете.",然而，我还是被一个朋友说服了：少有的几个我一直没有通过网络还保持着联系的老同学。
Everlasting_summer\Content\main\звуки\пролог\Me_102.json,6899A7E54D6AABF49BEEDEB6E1280E2F,Вечер. Мороз.(важное),一个寒冷的夜晚。(важное)
Everlasting_summer\Content\main\звуки\пролог\Me_103.json,1267EEAD41F9967E7F570E826CFF4191,Остановка и ожидание автобуса.,车站。静静地等。
Everlasting_summer\Content\main\звуки\пролог\Me_104.json,3A6954F542F03239F8F2A9BF781333C5,Я никогда не любил зиму.(важное),我从来都不太喜欢冬天。(важное)
Everlasting_summer\Content\main\звуки\пролог\Me_105.json,CF4377044115F6D56242B0AEB11375F2,"Впрочем, и жаркое лето – тоже не моя стихия.",虽然酷夏同样不吸引人。
Everlasting_summer\Content\main\звуки\пролог\Me_106.json,4FC1AA734F6EC8481EDECFA579956353,"Просто не вижу смысла выделять какое-то одно время года – не столь важно, какая погода на улице, если ты целыми днями сидишь дома.",我只是想不到任何一个理由挑出来一个对我来说特别的季节，对于我这种全天候在家的生活方式来说。
Everlasting_summer\Content\main\звуки\пролог\Me_107.json,FDB37F2B44CAC92BF8440595C54A8579,"Автобус сегодня задерживался так сильно, что я уже был готов плюнуть на всё и потратить последнюю пару сотен на такси (совсем не ехать мне почему-то в голову не пришло).",公交车今天迟迟不到，让我感觉见了鬼了，想要把最后几百个卢布花掉搭一辆出租车(不知为何我没有打回家的念头)。
Everlasting_summer\Content\main\звуки\пролог\Me_108.json,622B9EA243D170CF2EED8EA3EC25DC34,"В мозгу, как всегда, роились миллионы мыслей, из которых совершенно невозможно выудить хотя бы одну стоящую.",我的大脑里又有无数个想法飞过，不过几乎都没什么实际意义。
Everlasting_summer\Content\main\звуки\пролог\Me_109.json,0F1CA3D343C92EEFDBB55BAB98CDA983,"Такую, которую можно закончить, привести в порядок, облечь в форму идеи и претворить в жизнь.",没有一个想法是那种可以真正下手去做的。
Everlasting_summer\Content\main\звуки\пролог\Me_110.json,529E827B41103E9B949506B10A866146,"Может быть, заняться бизнесом?",也许我可以去创业？
Everlasting_summer\Content\main\звуки\пролог\Me_111.json,96E609794745DEB997E3B197C34A3E54,Но откуда я возьму деньги?,我要去哪里搞到启动资金呢？
Everlasting_summer\Content\main\звуки\пролог\Me_112.json,72C892AB4653C26C54B40085D03BB76C,Или пойти опять работать в офис?,也许我可以再去做一个办公室白领？
Everlasting_summer\Content\main\звуки\пролог\Me_113.json,7784D62F4294DB4B091C37837464B223,Нет уж!,不，这可不行！
Everlasting_summer\Content\main\звуки\пролог\Me_114.json,B70424394AD5876E89F0FC922F465097,"Может, стоит попробовать фриланс?",也许我适合做一名自由职业者？
Everlasting_summer\Content\main\звуки\пролог\Me_115.json,9396E1AF4A866AEE30F8A0B1A58080E3,"Да что я умею, и кому я нужен…",我有什么一技之长能让人看得上我呢？
Everlasting_summer\Content\main\звуки\пролог\Me_116.json,4F2A7F8C454D2BB36064EB91CE55EC5F,Вдруг мне вспомнилось детство…,我突然回忆起了我的童年，
Everlasting_summer\Content\main\звуки\пролог\Me_117.json,7AD3BC10435C5C015E183694323C1F66,Или скорее юношество – 15-17 лет.,或者说是我的青春...我十五六七岁的时候。
Everlasting_summer\Content\main\звуки\пролог\Me_118.json,2DE1333546E4D4E939C42C8E9993573F,Почему именно это время?,为什么是那些年呢？
Everlasting_summer\Content\main\звуки\пролог\Me_119.json,C98B370F43B9C2AD36B70F906E2FB812,Не знаю.,不知道。
Everlasting_summer\Content\main\звуки\пролог\Me_120.json,965352D341A198395A290C85A58BCA32,"Наверное, потому что тогда всё было проще.",我想应该是那个时候，我周围的一切还都显得那么简单。
Everlasting_summer\Content\main\звуки\пролог\Me_121.json,F2773B574EACDE3EC2F5C6A17BE9CB74,Было проще принимать такие сложные сейчас и такие простые тогда решения.,那个时候我能很轻易地作出决定，和现在完全不同。
Everlasting_summer\Content\main\звуки\пролог\Me_122.json,9217AC2C42C7E1E32CFED8B9C8C4C0E6,"Проснувшись с утра, я чётко знал, как пройдёт мой день, а выходных ждал с нетерпением – смогу отдохнуть, заняться любимыми делами: компьютер, футбол, встречи с друзьями.",早上起床的时候，我就知道我的这一天该怎么过，然后一直盼望着周末，我可以无忧无虑地玩：玩电脑、踢足球、和朋友们出去瞎逛。
Everlasting_summer\Content\main\звуки\пролог\Me_123.json,9E754A7F483EBB9CC944DF8A8FEB14D5,"А потом, когда наступит новая неделя, вновь примусь за учёбу.",那个时候，到了第二个星期，我都会打起精神继续学习。
Everlasting_summer\Content\main\звуки\пролог\Me_124.json,13A4D7F6405B1C3AF12A658A7B6B3FF6,"Ведь раньше не возникало этих мучительных вопросов «зачем», «кому это надо», «что изменится, если я это сделаю» или «что не изменится».",那个时候，没有现在这些烦人的问题，像是“为什么？”“谁在乎？”“有什么用？”之类的。
Everlasting_summer\Content\main\звуки\пролог\Me_125.json,3336593B49403DC40E38139A3DEFAFCF,"Простой поток жизни, такой привычный для любого нормального человека и такой чуждый для меня теперешнего.",对于今天我这样的人来说，是那么的简单质朴。
Everlasting_summer\Content\main\звуки\пролог\Me_136.json,F0B0A17243104F9A80F5FE8F31A2D964,Звук работающего двигателя вернул меня к реальности.(важное),发动机的巨大响声把我拉回了现实。(важное)
Everlasting_summer\Content\main\звуки\пролог\Me_137.json,DD08802F42720A3044A7AD96ADA21851,Подъехал автобус.(важное),一辆公交车到站了。(важное)
Everlasting_summer\Content\main\звуки\пролог\Me_138.json,BB3851514B117BEA3DAE75A682ED8A26,«Какой-то он не такой» – мелькнула мысль.(важное),这有些不正常，我感觉。(важное)
Everlasting_summer\Content\main\звуки\пролог\Me_139.json,668C759F48B4BAE3EA0DED9932A67B08,"Впрочем, какая разница – по этому маршруту ходит только 410-ый.(важное)",算了，无所谓：反正只有410公交走这条路线。(важное)
Everlasting_summer\Content\main\звуки\пролог\Me_140.json,B2FA4D3946E7D2302123179DA6407A5B,"Огни пролетают мимо, их холодный свет словно зажигает внутри давно погасшие чувства.(важное)",街道上的灯光纷纷掠过，好像它们是在我身体里面闪动一样，尝试着要点燃我没有生命力的灵魂。(важное)
Everlasting_summer\Content\main\звуки\пролог\Me_141.json,C780CEEF4BE8E2DEC877728E2DE23DA2,"Или не зажигает, а просто пробуждает…(важное)",也许只是需要唤醒它们而已。(важное)
Everlasting_summer\Content\main\звуки\пролог\Me_142.json,AD5FB445408CE46F9A50FF9B2C1D8D35,"Ведь «они» уже давно живут во мне, то затихая, то просыпаясь вновь.(важное)",因为那些感觉已经在我的身体中待了很长时间了，不断地醒了再睡，睡了又醒。(важное)
Everlasting_summer\Content\main\звуки\пролог\Me_143.json,F0A166B14A99D87F856378AF838435BD,Какая-то очень известная мелодия играла в радиоприёмнике у водителя.(важное),司机播放着十分熟悉的音乐，(важное)
Everlasting_summer\Content\main\звуки\пролог\Me_144.json,99E2BE7A4EE3ABCE8E7AE0AC218FE420,Но я её не слушал.(важное),不过我却没有听。(важное)
Everlasting_summer\Content\main\звуки\пролог\Me_145.json,9197AFC0436BB8D0549496B17FF08167,Я смотрел в запотевшее окно автобуса на проезжающие мимо машины.(важное),我透过车窗的雾气，望着过往的车辆。(важное)
Everlasting_summer\Content\main\звуки\пролог\Me_146.json,0855633B46E475F5D094D6AB404A34A7,"Ведь люди куда-то спешат, ведь им что-то нужно, и, погружённые в свои дела, они не задумываются о вопросах, мучающих меня.(важное)",因为人们总是着急去哪里，追求着自己想要的东西，被困在自己那小小的世界里，他们怎么可能来关心我？(важное)
Everlasting_summer\Content\main\звуки\пролог\Me_147.json,6D7208B14624A64CC4487A833F321DDB,"Наверное, у них тоже есть свои серьёзные проблемы, а может, им живётся куда легче.(важное)",他们也许自己也有着严重的问题，也许生活很轻松。(важное)
Everlasting_summer\Content\main\звуки\пролог\Me_148.json,3DCAC02244DD8DFBA8A65CAE74D0A33E,"Знать наверняка нельзя, так как все люди разные.(важное)",这你没法确定，因为每个人都是不同的，(важное)
Everlasting_summer\Content\main\звуки\пролог\Me_149.json,878D8CB3485B500A8C61C4BE67039316,"Или не разные?""(важное)",这应该是吧？(важное)
Everlasting_summer\Content\main\звуки\пролог\Me_150.json,83E0033941554B70E2FEF99A0C4A61B8,"Бывает, поступки человека легко предсказуемы, но, пытаясь заглянуть к нему в душу, видишь лишь непроглядную тьму.(важное)",有时一个人的行动很容易预测，但如果你想透过他的外表观察灵魂的本质，你只会看到难以捉摸的黑暗。(важное)
Everlasting_summer\Content\main\звуки\пролог\Me_151.json,3215C87941B9855E03256D8644A17F6E,"Автобус приближался к центру, и мои мысли прервал яркий свет огней большого города.(важное)",汽车接近市中心，我的想法被繁华的城市灯光打断。(важное)
Everlasting_summer\Content\main\звуки\пролог\Me_152.json,022DBE74487EBE5E9C129BA0603CECEA,"Сотни рекламных вывесок, тысячи машин, миллионы людей.(важное)",数不清的广告牌，眼花缭乱的车水马龙，以及成千上万的行人。(важное)
Everlasting_summer\Content\main\звуки\пролог\Me_153.json,53771E83439832B7B21C83B028448C7A,"Я смотрел на это светопреставление, и мне почему-то безумно захотелось спать.(важное)",看着看着，我感到有些困倦。(важное)
Everlasting_summer\Content\main\звуки\пролог\Me_154.json,A07ADB3642966AB892D1F998BC4173F8,Глаза закрылись всего на полсекунды и(важное),我稍微闭上眼歇了一会...(важное)
Everlasting_summer\Content\main\звуки\пролог\Uv_1_юля.json,6BDCF3E945B19DDD0B5CE1A1C6632E6B,Ты пойдёшь со мной?(важное),你会跟我走吗？(важное)
Everlasting_summer\Content\main\звуки\пролог\Uv_2_юля.json,D9388E64404C87E2FFCE399C70ED18C7,Ты пойдёшь со мной?(важное),你会跟我走吗？(важное)
