File,Key,CultureInvariantString,Translation
Everlasting_summer\Content\DialogSystem\знакомство\болталки\Ира.json,89CADC2D40D8D88E688EAAB99682EABA,Рад за тебя!,为你高兴！
Everlasting_summer\Content\DialogSystem\знакомство\болталки\Ира.json,5C8EFA7E4CA72F48CCFBF69DB6DCBE09,"Кстати, меня зовут Ира, а тебя?",对了，我叫伊拉，你呢？
Everlasting_summer\Content\DialogSystem\знакомство\болталки\Ира.json,404307084AE4F5E926F898AFE2EDFF0E,"Семен, я пойду.",谢苗，我走了。
Everlasting_summer\Content\DialogSystem\знакомство\болталки\Ира.json,0ED5BAA04B128692CC1C7DBF40123F24,"Ага, встретимся на пляже!",嗯，沙滩上见！
Everlasting_summer\Content\DialogSystem\знакомство\болталки\Лера.json,4BA673184E80E9E059E499BB63316A4E,Привет! Не могла бы ты рассказать немного о нашем лагере?,你好！你能稍微讲讲我们的营地吗？
Everlasting_summer\Content\DialogSystem\знакомство\болталки\Лера.json,1DBE524C4D4A6516BEEDDFB3FE2B26CA,"Привет! Здесь очень красиво, особенно природа. Вода, пляж, люди — всё просто замечательно.",你好！这里非常美，尤其是大自然。水、沙滩、人——一切都简直太棒了。
Everlasting_summer\Content\DialogSystem\знакомство\болталки\Лера.json,71DFD44E4B42541A9D71FAB487071A30,"Но больше всего мне нравится проводить здесь ночи. Как-нибудь прогуляйся тут ночью и поймёшь, о чём я говорю.",不过我最喜欢的是在这里度过夜晚。你哪天夜里出来走走，就明白我说的了。
Everlasting_summer\Content\DialogSystem\знакомство\болталки\Лера.json,227DF2AC46C9DA495A5B4B8909C4F426,"Спасибо за рассказ! Кстати, меня зовут Семен, а тебя?",谢谢你的讲述！对了，我叫谢苗，你呢？
Everlasting_summer\Content\DialogSystem\знакомство\болталки\Лера.json,328DCE5B405A551B792FBE9ECCB6AB0B,"Лера, очень приятно познакомиться.",列拉，很高兴认识你。
Everlasting_summer\Content\DialogSystem\знакомство\болталки\Лера.json,89ACA25C4093C8EDEA89F2A77E0F8254,"Ну что ж, мне пора. До встречи!",那么，我该走了。再见！
Everlasting_summer\Content\DialogSystem\знакомство\болталки\Лера.json,95F9CFB74D681E30544B7DB9D512E254,Пока!,拜拜！
Everlasting_summer\Content\DialogSystem\знакомство\болталки\Маша.json,A83A72F74E56EC6E63EAF09A71D1E77F,Привет! Можешь рассказать мне об этом лагере?,你好！你能给我讲讲这个营地吗？
Everlasting_summer\Content\DialogSystem\знакомство\болталки\Маша.json,2767F9A1479FCCCD263758BF24218B24,Привет! Это обычный пионерский лагерь. Я была в нескольких таких и этот почти не отличается.,你好！就是个普通的少先队营地。我去过好几个，这个跟其他的差不多。
Everlasting_summer\Content\DialogSystem\знакомство\болталки\Маша.json,FCF82D2448457C1C971B8DA70610F256,"Питание три раза в день, лагерные мероприятия, распорядок дня. Правда, вожатые здесь не так строго контролируют.",一日三餐、各种营地活动、统一作息。不过这里的辅导员管得相对宽松一些。
Everlasting_summer\Content\DialogSystem\знакомство\болталки\Маша.json,6A712121449103E4E213BC9B3448F9DA,"И, конечно, здесь рассказывают разные истории о лагере. Как я уже говорила, обычный лагерь.",当然，这里也流传着各种关于营地的故事。就像我说的，普通营地该有的都有。
Everlasting_summer\Content\DialogSystem\знакомство\болталки\Маша.json,38F1F89F4A8217410938A8A59C0EFD19,Понятно. А как тебя зовут?,明白了。你叫什么名字？
Everlasting_summer\Content\DialogSystem\знакомство\болталки\Маша.json,2AA6F6884FD85409D68667A6A469C699,Маша,玛莎。
Everlasting_summer\Content\DialogSystem\знакомство\болталки\Маша.json,D1CE2DFC4ADAE5E7C03A86BF371A1826,Я Семен.,我是谢苗。
Everlasting_summer\Content\DialogSystem\знакомство\болталки\Маша.json,B7661193461DB125D1C3EDA38335FBB7,А тебе здесь нравится?,那你喜欢这里吗？
Everlasting_summer\Content\DialogSystem\знакомство\болталки\Маша.json,6AAED70D4FBD48F28CB060B30D1C663D,"Да, из всех лагерей, в которых я была, этот лучше всего, хотя и не могу объяснить, почему.",喜欢，在我去过的所有营地中，这个是最好的，虽然我也解释不清为什么。
Everlasting_summer\Content\DialogSystem\знакомство\болталки\Маша.json,15B8A7EC4CC509E8FF3C30ABDB664896,Понятно. Я пойду.,明白了。我走了。
Everlasting_summer\Content\DialogSystem\знакомство\болталки\Маша.json,921A675D429F7C24324995BF10347A13," Хорошо, до встречи.",好的，再见。
Everlasting_summer\Content\DialogSystem\знакомство\болталки\Миша.json,0A11933C46244E250132FD9C84359D9F,Привет!,你好！
Everlasting_summer\Content\DialogSystem\знакомство\болталки\Миша.json,C006E9894CA4565DD2F67481E0F3CBC8,Привет!,你好！
Everlasting_summer\Content\DialogSystem\знакомство\болталки\Миша.json,7F025B13456E0ECA9BC43CA6D7EDFC9C,Меня зовут Семен.,我叫谢苗。
Everlasting_summer\Content\DialogSystem\знакомство\болталки\Миша.json,C0BBE87A45144A507FD06F8189FBFB1F,А меня Миша. Ты что-то хотел спросить?,我是米莎。你想问点什么吗？
Everlasting_summer\Content\DialogSystem\знакомство\болталки\Миша.json,E919F11A48782B62C35C598B687A1A4C,"Да, я хотел узнать, что тебе известно об Ольге Дмитриевне.",是的，我想了解一下关于奥尔加·德米特里耶夫娜你知道些什么。
Everlasting_summer\Content\DialogSystem\знакомство\болталки\Миша.json,34A4B03649834AA748680A8A4C4B5047,"О, она настоящий «зверь»! С ней лучше не связываться.",哦，她可是个真正的「猛兽」！最好离她远点。
Everlasting_summer\Content\DialogSystem\знакомство\болталки\Миша.json,6F20051D41ECE80DC4847C80B6B94325,Однажды она застала парней за попыткой развести костер в лагере. После этого она заставила каждого пересказать книгу о безопасности в лесу.,有一次，她逮到几个男生想在营地里生篝火。之后让他们每人把一整本森林防火手册背了一遍。
Everlasting_summer\Content\DialogSystem\знакомство\болталки\Миша.json,6FF211F9423E63FF4A1A5AAFA2A52141,"Также были случаи, когда двое ребят пытались плавать в неположенном месте, и потом им пришлось мыть машину.",还有人在禁游区游泳，被抓到之后罚去洗车。
Everlasting_summer\Content\DialogSystem\знакомство\болталки\Миша.json,CEDBCD44460697375D18838E369C73BF,"Были и другие инциденты, но я не знаю подробностей.",还有其他一些事，但细节我不清楚。
Everlasting_summer\Content\DialogSystem\знакомство\болталки\Миша.json,10A08CAA48F826EE84A096BC10600C62,"Характер у неё, конечно, взрывной. К счастью, она часто пропадает у себя с книжкой.",她脾气是真的火爆。好在她大多数时候都一个人在房间里看书，省事。
Everlasting_summer\Content\DialogSystem\знакомство\болталки\Миша.json,E82121684612CD736E0F1D91510C5557,Будь осторожен с ней.,对她小心点。
Everlasting_summer\Content\DialogSystem\знакомство\болталки\Миша.json,7CFB669D45F7942E1234D4BCFE2BC04E,"Хорошо, я учту это. До встречи!",好的，我会注意的。再见！
Everlasting_summer\Content\DialogSystem\знакомство\болталки\Миша.json,3ACFF0E447B899E3819BEDAA5E825C48,"Ага, только, пожалуйста, не рассказывай ей, что я про неё говорил.",嗯，只是请别跟她说我讲了她的那些话。
Everlasting_summer\Content\DialogSystem\знакомство\болталки\Миша.json,95410CA4426678F23CCC7EA95566FCB3,Хорошо.,好的。
Everlasting_summer\Content\DialogSystem\знакомство\болталки\Настя.json,5DDDECA74F1AC1BF7C32B19579DFB7CF," Привет! Можешь рассказать, чем можно заняться в лагере?",你好！能讲讲在营地里可以做什么吗？
Everlasting_summer\Content\DialogSystem\знакомство\болталки\Настя.json,6D4E2BFF45F2AF4DFDF5FF8BC430B05D,"Привет! В лагере есть библиотека, в которой много книг, но мне не нравится, что среди них мало художественной литературы.",你好！营地里有个图书馆，有很多书，但我不喜欢的是里面文学小说很少。
Everlasting_summer\Content\DialogSystem\знакомство\болталки\Настя.json,9493862E4FA1EDB0B4CDCABF1B4811BE,"Есть музыкальный кружок, но я не умею играть и не хочу учиться.",有个音乐小组，但我不会演奏也不想学。
Everlasting_summer\Content\DialogSystem\знакомство\болталки\Настя.json,2742BDA140C81CE044F93DB878546BBA,"Клуб энергетиков не для меня, хотя два друга активно пытаются всех туда привлечь, но делают это слишком настойчиво.",动力爱好者俱乐部不适合我——虽然有两个人一直在积极拉人入伙，但那架势实在太让人烦了。
Everlasting_summer\Content\DialogSystem\знакомство\болталки\Настя.json,43A9F2294C2FD86261F7F4BCEAF984BE,"Я хотела помогать местной медсестре, но она настолько популярна, что пионеры бегут к ней даже по пустяковым причинам.",我本来想帮营地的护士干活，但她太受欢迎了，少先队员们连芝麻大点的事都要跑去找她。
Everlasting_summer\Content\DialogSystem\знакомство\болталки\Настя.json,03BC7D3F4904905A9D8CA7B160C8DB28, Неужели тебе совсем нечем заняться?,难道你真的一点事都没得做吗？
Everlasting_summer\Content\DialogSystem\знакомство\болталки\Настя.json,AC774F424364A2D54CE7AD8F18710152,"Я люблю танцевать, но здесь для этого нет подходящих условий.",我喜欢跳舞，但这里根本没有合适的条件。
Everlasting_summer\Content\DialogSystem\знакомство\болталки\Настя.json,246731E04FD2FCF3138E9C95E82429C8,"Ясно, меня зовут Семен.",明白了，我叫谢苗。
Everlasting_summer\Content\DialogSystem\знакомство\болталки\Настя.json,BFA1ECCA4BB7B23245C21198EBD447BF,А меня Настя.,我叫娜斯佳。
Everlasting_summer\Content\DialogSystem\знакомство\болталки\Настя.json,BBF726574A46B18F96A28789754BA01C,"Спасибо за информацию, я пойду.",谢谢你提供的信息，我走了。
Everlasting_summer\Content\DialogSystem\знакомство\болталки\Настя.json,D504E99A43104E457FF592BB15976C6D,"Приходи, если что-то понадобится.",如果有需要就过来。
Everlasting_summer\Content\DialogSystem\знакомство\болталки\нечегосказать.json,ACA492274D2561BCFD7327854AE50843,"Я захотел познакомиться и как-то начать разговор, но не смог придумать подходящую тему.",我想认识她，想找个话题聊起来，但脑子里就是想不出。
Everlasting_summer\Content\DialogSystem\знакомство\болталки\нечегосказать.json,F06E89E943D908C6317420ADD8D934FB,"Жизнь затворника имеет свои недостатки. Общение с компьютером, конечно, гораздо проще.",宅男的通病。跟电脑打交道当然容易多了。
Everlasting_summer\Content\DialogSystem\знакомство\болталки\нечегосказать.json,2124F159488765594E9D8599A337467E,"Мы молча смотрели друг на друга, и я решил уйти.",我们默默地看着对方，于是我决定离开。
Everlasting_summer\Content\DialogSystem\знакомство\болталки\Николай.json,08E3C4444CDB847A409611AA36FDF260,Привет! Ты можешь мне подсказать немного по лагерю.,你好！你能给我指点一下营地的事吗？
Everlasting_summer\Content\DialogSystem\знакомство\болталки\Николай.json,7F0B145E4456B325812935B71203C1DB,"Привет, конечно!",你好，当然可以！
Everlasting_summer\Content\DialogSystem\знакомство\болталки\Николай.json,F088EA464E31837F89B772BF900417DB,Что тебя интересует?,你对什么感兴趣？
Everlasting_summer\Content\DialogSystem\знакомство\болталки\Николай.json,D63D997A4022E5D61FE5099AEF9CEEC3,"Может, ты знаешь, как выбраться отсюда?",或许，你知道怎么从这里出去吗？
Everlasting_summer\Content\DialogSystem\знакомство\болталки\Николай.json,D27010B74AD78CB174CC81A4B30F5F8A,"Ну если к дороге, что с двух сторон лагеря есть забор.",嗯，如果说去大路，营地两边都有栅栏。
Everlasting_summer\Content\DialogSystem\знакомство\болталки\Николай.json,D552570945ED867B0A183EBF2D3D2CED,"А если в лес, то есть 3 выхода по периметру",如果说去森林，周边有三个出口。
Everlasting_summer\Content\DialogSystem\знакомство\болталки\Николай.json,BD2D2E25451CE4B9B6DDA796F6643E1D,"Нет, ты не понимаешь, я говорю про вообще.",不，你没明白，我说的是彻底离开这里。
Everlasting_summer\Content\DialogSystem\знакомство\болталки\Николай.json,3EC8F944421D272BF88EF5A45034B710,"Ааа! Ну если в деревню собрался, по главной дороге до конца.",啊啊！嗯，如果你想去村子，就沿着主路走到头。
Everlasting_summer\Content\DialogSystem\знакомство\болталки\Николай.json,81319F08428F2F45E97BFF9B662E75CE,"Правда, я не знаю, сколько идти придется.",不过，我不知道得走多久。
Everlasting_summer\Content\DialogSystem\знакомство\болталки\Николай.json,CD0682484D5944A24652D0AAE9DEC186,"Нет, я не про деревню",不，我不是说村子。
Everlasting_summer\Content\DialogSystem\знакомство\болталки\Николай.json,AE666200460078334561FF8E938818B9,"Допустим, город или райцентр, здесь ведь по-любому есть способ.",假设是去城市或者区中心，这里肯定有办法的。
Everlasting_summer\Content\DialogSystem\знакомство\болталки\Николай.json,9187DC8E4F322AE00DB9378B736125E9,"Это только на автобусе, как и все прибывшие сюда.",这只能坐公交车，和所有来这里的人一样。
Everlasting_summer\Content\DialogSystem\знакомство\болталки\Николай.json,D0A12B734FB553967FD19C84A14048D0,А больше нет никакого транспорта?,再也没有其他交通工具了吗？
Everlasting_summer\Content\DialogSystem\знакомство\болталки\Николай.json,01BF78094AA4200626B9C5BDD110EE4D,"Нет, только автобус.",没有了，只有公交车。
Everlasting_summer\Content\DialogSystem\знакомство\болталки\Николай.json,4FE346D4450B98591F7AC292F3EC033C,"Конечно, тут есть судоходная речка.",当然，这里有条可以通航的河。
Everlasting_summer\Content\DialogSystem\знакомство\болталки\Николай.json,9FE53D2A4C714B7F9F4FA1A30CF67B5F,"Но, думаю, приплывать сюда под завязку набитым паромом как-то не очень.",不过满满一船的渡轮……想想就有点受不了。
Everlasting_summer\Content\DialogSystem\знакомство\болталки\Николай.json,90E5DCB74CDCDCEAD59EC0BEEC16D047,"Ладно, спасибо за помощь.",好吧，谢谢你的帮助。
Everlasting_summer\Content\DialogSystem\знакомство\болталки\Николай.json,805FF9AD462F1572DD0512A2B6892DDD,Меня Семён зовут.,我叫谢苗。
Everlasting_summer\Content\DialogSystem\знакомство\болталки\Николай.json,1B8EE3ED4A3736E48F7BE387FC5F248F,А меня Коля зовут.,我叫科利亚。
Everlasting_summer\Content\DialogSystem\знакомство\болталки\Николай.json,62DCFF73405CB856A91577A36399D985,"Очень приятно, до встречи!",很高兴认识你，再见！
Everlasting_summer\Content\DialogSystem\знакомство\болталки\Николай.json,2DE351014D6CDE3BAD2673AA08233871,Пока,拜拜。
Everlasting_summer\Content\DialogSystem\знакомство\болталки\Нина.json,599BA1BE4ABBAA6C0EC8908B32472B93,Привет! Можешь немного рассказать о лагере?,你好！能稍微讲讲营地的事吗？
Everlasting_summer\Content\DialogSystem\знакомство\болталки\Нина.json,DC1126444D5D489D23F20D97801306CF,"Привет! Я не очень много знаю, но есть одна забавная история.",你好！我知道的不多，但有一个好笑的故事。
Everlasting_summer\Content\DialogSystem\знакомство\болталки\Нина.json,57D70B794C3ACF18659C4FA46AED4FEC,"Несколько дней назад казалось, что машина возле столовой забыта теми, кто строил этот лагерь. Но теперь она блестит как алмаз!",几天前，食堂旁边那辆车还像是建这个营地时被人遗忘在这里的。现在它擦得跟钻石一样锃亮！
Everlasting_summer\Content\DialogSystem\знакомство\болталки\Нина.json,935507EF442D16140BBEE190790192D9,Кто же так помыл её?,是谁把它洗成这样的？
Everlasting_summer\Content\DialogSystem\знакомство\болталки\Нина.json,58510DB240DD41D1993476B2A5015722,"У нас были два любителя поплавать до островов на спор, кто быстрее. Но так как до острова можно добираться только на лодке, нашей вожатой это не понравилось.",我们营地有两个人打赌，看谁先游泳到岛上。但那个岛只能坐船过去，辅导员一听就不乐意了。
Everlasting_summer\Content\DialogSystem\знакомство\болталки\Нина.json,93179C2C4540A782172BEC828352DD0E,"Когда она увидела этих счастливых ребят, возвращающихся обратно, я думала, что она взорвётся. Что, в принципе, и произошло.",看到那俩人乐呵呵地游回来的时候，我还以为她要当场爆炸。事实上，她确实炸了。
Everlasting_summer\Content\DialogSystem\знакомство\болталки\Нина.json,C641BF4943D83E352EA8C899C42D19BB,"Их лица за секунду изменились, а голос вожатой было слышно во всём лагере.",那俩人脸色瞬间就变了，辅导员的声音整个营地都听得到。
Everlasting_summer\Content\DialogSystem\знакомство\болталки\Нина.json,90745AB1466105B61F3CA88588E87DA6,"Эти бедолаги, наверное, дня три мыли машину, пока вожатая не осталась довольна результатом.",这两个可怜蛋大概洗了三天车，直到辅导员满意为止。
Everlasting_summer\Content\DialogSystem\знакомство\болталки\Нина.json,46AA90194F853A67EB75299DD441227C,Забавно!,真有意思！
Everlasting_summer\Content\DialogSystem\знакомство\болталки\Нина.json,F2FB7EDD4B719558E65928B85C88D82E,"Кстати, меня зовут Нина, а тебя как?",对了，我叫尼娜，你叫什么？
Everlasting_summer\Content\DialogSystem\знакомство\болталки\Нина.json,873424314751C0E1E217D0956D1541E1,Семен.,谢苗。
Everlasting_summer\Content\DialogSystem\знакомство\болталки\Нина.json,B1851939428D8C9D72B04B85CEEEF368,"Ты приходи ещё, поболтаем, если будет что-то интересное.",你以后再来啊，要是有有趣的事，我们再聊。
Everlasting_summer\Content\DialogSystem\знакомство\болталки\Повариха.json,70A7A71C489571DD5276F69D9B1A9C05,"Привет, пионер! Новенький? Меня Нина зовут. Как тебе наша еда сегодня?",你好，少先队员！新来的？我叫尼娜。你觉得我们今天的饭怎么样？
Everlasting_summer\Content\DialogSystem\знакомство\болталки\Повариха.json,9613AA8141F3D4D85986648EE7221A35,"Меня — Семён. Эээ... Здравствуйте, тетя Нина! Если честно, я ожидал чего-то более вкусного на завтрак... Эта утренняя каша как-то не совсем радует. Вот борщик — другое дело.",我叫谢苗。呃……尼娜阿姨您好！说实话，早饭我期待更好一点……这早上的粥吃着总觉得少点什么。不过红菜汤就是另一回事了。
Everlasting_summer\Content\DialogSystem\знакомство\болталки\Повариха.json,2169A1CC4980A91975999B8AE84E5DD1,"Ишь-ты! Поди-ж ты! Худой ещё, клещ, кушать надо! Ну не будь слишком строгим... Я сделала ее на молоке, добавила сахар. Может, с вареньем станет вкуснее?",你说什么呢！哎哟！瘦得跟根柴火似的，要多吃！行了，也别太挑剔……我是用牛奶煮的，还加了糖，放点果酱会好吃一些，要不要试试？
Everlasting_summer\Content\DialogSystem\знакомство\болталки\Повариха.json,E6B11D9B41EBB557F6F341A32716AC0A,Варенье! Это уже другой разговор! А будут пирожки с капустой?,果酱！那就不一样了！那卷心菜馅饼还会有吗？
Everlasting_summer\Content\DialogSystem\знакомство\болталки\Повариха.json,ED3CE518402FAA6E0A32A9BD14A9CF36,Пирожки только по праздникам!,馅饼只在过节才有！
Everlasting_summer\Content\DialogSystem\знакомство\болталки\Повариха.json,7ACA307746D2C9BEFF3FB7ADAED17B3D,Досадно...,真遗憾……
Everlasting_summer\Content\DialogSystem\знакомство\болталки\Повариха.json,F43059EB4A7E0863F07806A878CA425D,"Чего ты болтаешь, прохлаждаешься? У нас работы непочатый край!",你在这儿磨蹭什么，闲聊？我们这儿活堆成山了！
Everlasting_summer\Content\DialogSystem\знакомство\болталки\Повариха.json,05D701F648A02E6A39240FAECAA454BF," Тетя Нина! Я просто... думал о том, как бы улучшить ваше меню.",尼娜阿姨！我只是……在想怎么帮您改进一下菜单。
Everlasting_summer\Content\DialogSystem\знакомство\болталки\Повариха.json,BE9E820246302C39C2FE3CA74CC9EEC7,"Хорошие мысли, но думать не на кухне надо! Лучше прими участие в делах лагеря. А если не хочешь, могу предложить тебе мыть всю посуду после обеда!",想法倒不错，但别在厨房里想！还是多参与参与营地里的活动。要是不想，我可以让你午饭后来刷所有的碗！
