File,Key,CultureInvariantString,Translation
Everlasting_summer\Content\DialogSystem\знакомство\повтори.json,A3CED61449367BC88016C9954DDD6930,"Три вагона, один из них ненастоящий!",三节车厢，其中有一节是假的！
Everlasting_summer\Content\DialogSystem\знакомство\повтори.json,D1FE3FEB45296B74103D66AD97A7C265,"Они обсолютно идентичны, но есть аномальный",它们完全相同，但有一节存在异常。
Everlasting_summer\Content\DialogSystem\знакомство\повтори.json,97E0FBBA4DC126FDA5EB7FB50D55CAA7,Именно он отличается от других интерьером,正是这节车厢的内部陈设和其他不同。
Everlasting_summer\Content\DialogSystem\знакомство\повтори.json,A4D2ED264F6952F84E623A9B29461F33,"Смотри на мельчайшие детали, там могут быть переставлены вещи или добавлены новые, а могу совсем отсуствовать",留意最微小的细节，那里可能有些东西被移动过，或者被添加了新的，也可能完全缺失。
Everlasting_summer\Content\DialogSystem\знакомство\повтори.json,5E1C61B14A258D50E820EE8EF2A9C691,"Будь внимателен, и обращай внимания на плакаты и стенды",留心观察，注意海报和展板。
Everlasting_summer\Content\DialogSystem\знакомство\повтори.json,776108344D6F7064E7E892B56B06B197,Понял,明白了。
Everlasting_summer\Content\DialogSystem\знакомство\поезд.json,E583FA544F0521923ACEACBBC405F629,"Фух, еле удрали",呼，好不容易才逃掉。
Everlasting_summer\Content\DialogSystem\знакомство\поезд.json,EE0AD302413D44F772EFAEBA265A96C8,Вы будто призрака увидели,你们好像见了鬼似的。
Everlasting_summer\Content\DialogSystem\знакомство\поезд.json,4A7EC21E4198B784071B73B2E4331E8A,"Ты не поверишь, но там и правда какая-то чертовщина!",你不会信的，里面真的有某种邪门的东西！
Everlasting_summer\Content\DialogSystem\знакомство\поезд.json,1FFED1AB4F631F8C7CF5E7AF79D046D3,Звучит неубедительно,听起来没什么说服力。
Everlasting_summer\Content\DialogSystem\знакомство\поезд.json,6EAE0BFB44D82FAA4D20C487626B6247,"Если хочешь, иди сам проверь, а я туда ни ногой",你要是想，就自己去看吧，我反正是一步也不踏进去了。
Everlasting_summer\Content\DialogSystem\знакомство\поезд.json,1914277945C9E19CB488A08098926511,Я тоже.,我也是。
Everlasting_summer\Content\DialogSystem\знакомство\поезд.json,7E05901449014A3241866D98C339A81B,Да что там случилось?,那里到底发生了什么？
Everlasting_summer\Content\DialogSystem\знакомство\поезд.json,B06A4567464671DBE0136784B60C668A,Там в Лену будто что-то вселилось,那里好像有什么东西附在了列娜身上。
Everlasting_summer\Content\DialogSystem\знакомство\поезд.json,BD4C60534CAA598D77A5BBB8D7C98ABE,Бродит жутко по темным вагонам с ножом никого не признает,她拿着刀，在黑暗的车厢里阴森森地来回游荡，谁也不认了。
Everlasting_summer\Content\DialogSystem\знакомство\поезд.json,9E0FF2B74AA98664EA5A248A54B4901E,А еще там осталась Мику,而且未来还留在里面。
Everlasting_summer\Content\DialogSystem\знакомство\поезд.json,91E9D1A74D51D89001F7F4AB56C328FE,Где она?,她在哪？
Everlasting_summer\Content\DialogSystem\знакомство\поезд.json,5B7A60134EA52754F793ECB06F4A0C0C,Мы незнаем где-то прячется,我们不知道，她藏在某个地方了。
Everlasting_summer\Content\DialogSystem\знакомство\поезд.json,C835457C48BCCB5E3873DB87FACF3D52,"Ладно, пойду посмотрю ",好吧，我去看看。
Everlasting_summer\Content\DialogSystem\знакомство\поезд.json,F13FA56C421A161FDE223B8165D4D94B,....,……
Everlasting_summer\Content\DialogSystem\знакомство\поезд.json,C209BE3A4BF8AE8921F2498C823B0434,Куда идешь?,你去哪？
Everlasting_summer\Content\DialogSystem\знакомство\поезд.json,D0DD15C6450D8FFFB2B677867C315868,"Меня остановила девочка, которую, я где-то видел, но не могу вспомнить ее имени",一个女孩叫住了我，我之前在哪儿见过她，但想不起她的名字了。
Everlasting_summer\Content\DialogSystem\знакомство\поезд.json,334052FE4F43E3FB2924D9A7F8DC3E5A,"За Мику, она там прячется ",去找未来，她藏在那里面。
Everlasting_summer\Content\DialogSystem\знакомство\поезд.json,A28A3AFF49BFBAFAE701A692F0993CE8,Оно тебе не даст,它是不会让你得逞的。
Everlasting_summer\Content\DialogSystem\знакомство\поезд.json,254565B14B12C954D91ECB8AE91939D9,Кто?,谁？
Everlasting_summer\Content\DialogSystem\знакомство\поезд.json,E9926A3F43701637576F9B8ED1C5BC6D,"То, что захватило вагон",那个占据了车厢的东西。
Everlasting_summer\Content\DialogSystem\знакомство\поезд.json,969277E944C788A5BD05AAA60D363497,Послушай,听着。
Everlasting_summer\Content\DialogSystem\знакомство\поезд.json,AF8260B342D180C7279BECAB9EFC9BE6,"Оно прячется в каком-то из вагонов, который маскируется под обычный",它就藏在某一节伪装成普通车厢的车厢里。
Everlasting_summer\Content\DialogSystem\знакомство\поезд.json,BFE1209145497AF60A327A82D33A0D75,Запомни,记住。
Everlasting_summer\Content\DialogSystem\знакомство\поезд.json,39CEC876437F698C964A00A9DE6BB9EE,"Там 3 вагона, один из них ненастоящий",那里有3节车厢，其中一节是假的。
Everlasting_summer\Content\DialogSystem\знакомство\поезд.json,763F85754875F92276A785BFA98C2C94,И как я пойму?,那我怎么分辨？
Everlasting_summer\Content\DialogSystem\знакомство\поезд.json,A1D5476647A7019DA9E41C9FEF77369E,"Все вагоны идентичны друг другу, кроме одного",所有车厢彼此都一样，除了那一节。
Everlasting_summer\Content\DialogSystem\знакомство\поезд.json,F585B735448D867179F41B804B089FFE,"Обращай внимания на вещи внутри, если найдешь несоответствие, то скажи мне",注意车厢里的东西，如果你发现了不一致的地方，就告诉我。
Everlasting_summer\Content\DialogSystem\знакомство\поезд.json,75A704974183ACE679AC659232D54D59,"Если правильно определишь ненастоящий вагон, мы избавимся от нечисти",如果你正确指出了假车厢，我们就能清除掉这个邪物。
Everlasting_summer\Content\DialogSystem\знакомство\поезд.json,EB2C6D924276552CC7F5BBBEE5C74555,А если нет?,要是错了吗？
Everlasting_summer\Content\DialogSystem\знакомство\поезд.json,8F6A61BA4CD07E7DDD39558915EFDDED,То оно доберется сюда,那它就会来到这里。
Everlasting_summer\Content\DialogSystem\знакомство\поезд.json,5F362FB84F94C6DCABD25B8EFCB00977,"Хорошо, я найду и скажу",好，我会找到并告诉你的。
Everlasting_summer\Content\DialogSystem\знакомство\попытаться_включит_Рь.json,AE3B6E064FEF065955D1359E02CEC7C8,Я подвигал переключатель несколько раз вверх-вниз,我把那个开关上下拨动了好几次。
Everlasting_summer\Content\DialogSystem\знакомство\попытаться_включит_Рь.json,227BF06042388C2E591E93AEE4F7C295,Ничего не произошло,什么都没有发生。
Everlasting_summer\Content\DialogSystem\знакомство\попытаться_включит_Рь.json,461D27694B22B60C716F96B2FF824991,"Наверное, не хватает деталей",大概是缺少零件。
Everlasting_summer\Content\DialogSystem\знакомство\привел_мику.json,783C513E4E6D6F87C847A6BDCC97817E,"Спасибо тебе огромное, Семен!",谢苗，真的太谢谢你了！
Everlasting_summer\Content\DialogSystem\знакомство\привел_мику.json,BB95C32B47A095165793A190922F3459,"Я даже не знаю, как тебя отблагодарить",我都不知道怎么回报你才好。
Everlasting_summer\Content\DialogSystem\знакомство\привел_мику.json,9D08E4F640330E20BCD79DB5D0917F84,"Все в порядке, я не мог там тебя оставить",没事的，我不能把你一个人留在那里。
Everlasting_summer\Content\DialogSystem\знакомство\привел_мику.json,D2783C454664528045E22A9CC9084947,"Спасибо еще раз, я никогда этого не забуду",再次谢谢你，我永远都不会忘记的。
Everlasting_summer\Content\DialogSystem\знакомство\привел_мику.json,0E3154CF4181E7F680CE5FB0E6D0042D,Мику обняла меня,未来抱住了我。
Everlasting_summer\Content\DialogSystem\знакомство\привел_мику.json,34A5D49B483F23D69D1712B087804F2E,"Теперь все позади, можешь отдыхать",一切都过去了，好好休息吧。
Everlasting_summer\Content\DialogSystem\знакомство\привел_мику.json,C0F226A44A39914160CA3FBE5C525EAA,А мне нужно еще закончить с кое-чем,而我还有点事需要去收尾。
Everlasting_summer\Content\DialogSystem\знакомство\привел_мику.json,F2B6BBDF4E9769DD767EDFBE900FCADE,Хорошо,好的。
Everlasting_summer\Content\DialogSystem\знакомство\привел_мику.json,513BEF944C985AC0EBBE0AB5A64F8D2A,",,,",……
Everlasting_summer\Content\DialogSystem\знакомство\пригласил_виолу.json,4C76EFD9436197161DFA8AA2AB04AD09,Это так мило с твой стороны,你真的好体贴。
Everlasting_summer\Content\DialogSystem\знакомство\пригласил_виолу.json,DE55FCF740B54C02C45896B9C64810C3,"Думаю, нечего страшного не случится за это время.",我想这段时间里应该不会出什么事。
Everlasting_summer\Content\DialogSystem\знакомство\пригласил_виолу.json,7ABAD33E49742F0D04267681757772E1,"Смотри, Семен, пока я не натанцуюсь, ты не будешь свободен.",听好了，谢苗，我跳够之前，你别想走。
Everlasting_summer\Content\DialogSystem\знакомство\пригласил_виолу.json,C696C7A34C1DFE9FAEE596B01872B852,Хорошо,好吧。
Everlasting_summer\Content\DialogSystem\знакомство\пригласил_виолу.json,110C6C4347AA4188A69BADBC2B873F01,Мы вышли на середину площади,我们走到了广场中央。
Everlasting_summer\Content\DialogSystem\знакомство\пригласил_од.json,3E15A0014DDC504FFA4A5998075429B4,"Так, Семен, я не поняла, а ты чего не танцуешь?",喂，谢苗，你怎么不跳啊？
Everlasting_summer\Content\DialogSystem\знакомство\пригласил_од.json,4316B7284DA7DC8601018B8E48B2F662,Да я как-то не планировал особо,是，我本来也没特别打算跳。
Everlasting_summer\Content\DialogSystem\знакомство\пригласил_од.json,93D311A04AF8463CB4C531BA58375882,Глупости все это. Другого шанса может не представиться,别犯傻了。这种机会可不会有第二次。
Everlasting_summer\Content\DialogSystem\знакомство\пригласил_од.json,D8DB98944B46633141E844B672259194,"Да, но я все же воздержусь",是的，但我还是算了吧。
Everlasting_summer\Content\DialogSystem\знакомство\пригласил_од.json,73421A694A557F85527AA6BD1CC65D07,"Нечего не знаю, марш танцевать!",不管了，给我去跳！
Everlasting_summer\Content\DialogSystem\знакомство\пригласил_од.json,D796AEA94FF08A16F0D3B9A8DC38EC46,Удумал мне тут,还想跟我讲条件。
Everlasting_summer\Content\DialogSystem\знакомство\пригласил_од.json,F44B2F1F43240B32E73586A7F707F203,Мы вышли на середину площади,我们走到了广场中央。
Everlasting_summer\Content\DialogSystem\знакомство\пригласим_мику.json,8B8EB5BF4E8C3D100761718265B693C1,А? Что!? Ты и в правду меня приглашаешь!?,啊？什么！？你……你真的要邀请我！？
Everlasting_summer\Content\DialogSystem\знакомство\пригласим_мику.json,52072A8740A702851F715AB5CA6DFB1F,Конечно.,当然。
Everlasting_summer\Content\DialogSystem\знакомство\пригласим_мику.json,8C6A3CFF4ADB43AFCBED2A8728DCD8AF,"Хорошо, просто я....",好的，只是我……
Everlasting_summer\Content\DialogSystem\знакомство\пригласим_мику.json,BB20393A4ED56ED27A1A81AFE011E6BB,Хотя не важно. Пойдем.,不过不重要了。我们走吧。
Everlasting_summer\Content\DialogSystem\знакомство\пригласим_мику.json,CFE7F3B146E7891BE7460FB0B5EE3F1C,Мы вышли на середину площади,我们走到了广场中央。
Everlasting_summer\Content\DialogSystem\знакомство\прошел.json,B532996D40C240020D5C59B4ED9A5ED7,"Полагаю, у нас все получилось",我想，我们成功了。
Everlasting_summer\Content\DialogSystem\знакомство\прошел.json,67442D974CBD2EA9EEFCE38C2BE4130A,И что теперь?,那现在呢？
Everlasting_summer\Content\DialogSystem\знакомство\прошел.json,221DE3E4481CF052EAAFEE9C5B9E008F,????,？？？？
Everlasting_summer\Content\DialogSystem\знакомство\прошел.json,0E1774E24E3BE68D06E1199CC67A4ADC,Куда она делась!?,她跑哪儿去了！？
Everlasting_summer\Content\DialogSystem\знакомство\прошел.json,3C628E144323EBD53B913DA9C1B4D5F8,"Семен, займи свое место, мы отправляемся",谢苗，回到你的座位上去，我们出发了。
Everlasting_summer\Content\DialogSystem\знакомство\прошел.json,73E82FE54B577B2F7853828ABA381C51,"А? Да, хорошо",啊？好，好的。
Everlasting_summer\Content\DialogSystem\знакомство\прошел.json,BA8C2F594476BC8240C195A0FB2FDA77,....,……
Everlasting_summer\Content\DialogSystem\знакомство\прошел.json,C8E9363D4C45AD18294DF395BEBCA9D3,Куда же она делась? ,她到底去哪了？
Everlasting_summer\Content\DialogSystem\знакомство\прошел.json,9301209E4EB9C28C83EFAE8E1D526108,И кто она?,她又是谁？
Everlasting_summer\Content\DialogSystem\знакомство\прошел.json,967E12DE41F79F16502273B8DD77ABD1,"А впрочем, неважно",不过，算了，不重要。
Everlasting_summer\Content\DialogSystem\знакомство\ринка_убежал.json,55A8FA4443D43C5431E13A82FAE1DF35,А что это ты тут делаешь?,你在这里干什么呢？
Everlasting_summer\Content\DialogSystem\знакомство\ринка_убежал.json,7E55731B44CA0EFF13D449B2D80F1013,"Ты слишком далеко ушел, заблудиться же можешь!",你走得太远了，可是会迷路的！
Everlasting_summer\Content\DialogSystem\знакомство\ринка_убежал.json,D2C44D03417385E3DA5E4F9AC913912F,"Пойдем со мной, пойдем, я провожу тебя в лагерь",跟我来，走，我送你回营地。
Everlasting_summer\Content\DialogSystem\знакомство\сигареты.json,D0234537416672F1D9FC619E6501A47A,"Семен, ты в своем уме!?",谢苗，你疯了吗！？
Everlasting_summer\Content\DialogSystem\знакомство\сигареты.json,4CD2222340BC7AB59FB5959D9C6D3584,Где ты вообще взял эту гадость?,你到底从哪弄来这种肮脏东西的？
Everlasting_summer\Content\DialogSystem\знакомство\сигареты.json,07D177AB448FD5806151CDBCE52BF7B8,"Честно признаться, сказать мне было совершенно нечего",老实说，我完全无言以对。
Everlasting_summer\Content\DialogSystem\знакомство\сигареты.json,90F011B8472CFD74A8BDE388396D3594,"Я сейчас был похож на школьника, которого поймали с сигаретами за школой",我此刻就像个在学校后面被抓到抽烟的小学生。
Everlasting_summer\Content\DialogSystem\знакомство\сигареты.json,135C8C364CF0BFDC3BC0F9A22C0CC3A8,"И в голову не приходила ни единая мысль, которая могла бы логически объяснить происходящее",脑子里想不出任何一句话，可以合乎逻辑地解释眼前发生的事情。
Everlasting_summer\Content\DialogSystem\знакомство\сигареты.json,CA69EBB9441A5214EF778AA7A7E5B887,"Не говорить же ей правду, где я нашел сигареты, и что мне захотелось покурить",总不能告诉她实话，说我在哪里找到了烟，然后自己突然想抽一根吧。
Everlasting_summer\Content\DialogSystem\знакомство\сигареты.json,3E0266644BA60D6210EDB481963848B6,Что молчишь?,你沉默什么？
Everlasting_summer\Content\DialogSystem\знакомство\сигареты.json,55290E8B4D310FEF04CDB8BCAF25EE37,Простите,对不起。
Everlasting_summer\Content\DialogSystem\знакомство\сигареты.json,4E923E9F45A3962046F27CB558B566E8,Виновато выдавил я из себя,我愧疚地挤出了这句话。
Everlasting_summer\Content\DialogSystem\знакомство\сигареты.json,19539D2648490D4E01D47A92C9AB9E46,"Семен, настоящие пионеры себя так не ведут",谢苗，真正的少先队员不应该有这种行为。
Everlasting_summer\Content\DialogSystem\знакомство\сигареты.json,D9231795464633AFD95994AC8558ACCF,Ты теперь наказан,你现在被罚了。
Everlasting_summer\Content\DialogSystem\знакомство\сигареты.json,84B2DA0D4505B05290A866BD8C9743EF,Иди за мной,跟我走。
Everlasting_summer\Content\DialogSystem\знакомство\сигареты.json,6089F18A438C03A84E4D099D214FC36F,Мы пришли в здание администрации,我们来到了行政楼。
Everlasting_summer\Content\DialogSystem\знакомство\сигареты.json,72FB48CE4CA2931D3891D9BA3A2D3CDA,Бери метлу и принимайся за уборку,拿起扫帚，开始打扫。
Everlasting_summer\Content\DialogSystem\знакомство\сигареты.json,0ED5F9AC4C992E595D762CB133A0C3D1,"Пока все не подметешь, отсюда не выйдешь",不把所有地方扫干净，就别想离开这里。
Everlasting_summer\Content\DialogSystem\знакомство\сигареты.json,7D62EF6F4052274BBB148CB2AFD34CB8,Хорошо,好。
Everlasting_summer\Content\DialogSystem\знакомство\сигареты.json,9CADF27B479965CFB6AD3D8E9BE1E10E,Неохотно согласился я,我不情愿地答应了。
Everlasting_summer\Content\DialogSystem\знакомство\случилось.json,3801DAC542A96AB89E8DA18BF74FE761,Хотя я догадывался в чем причина,虽然我多少猜到是什么原因。
Everlasting_summer\Content\DialogSystem\знакомство\случилось.json,B5B13B964D8A482BC4A94CA02AF04AD5,"Одиночество — это та жизнь, которая была привычной для меня еще несколько дней назад",孤独——是几天前我还习以为常的生活。
Everlasting_summer\Content\DialogSystem\знакомство\случилось.json,9159657F4A7F004BB4235494D865E3AC,А для некоторых оно становится не выносимой пыткой,而对有些人来说，它却变成了难以忍受的折磨。
Everlasting_summer\Content\DialogSystem\знакомство\случилось.json,200A4FAE4AD80266AFB40882C04BDB2F,Мику через время ответила...,未来过了一会儿才回应……
Everlasting_summer\Content\DialogSystem\знакомство\случилось.json,02A53716483CA8E6AAA649B2B7390543,Ничего. Оставь меня одну...,没什么。让我一个人待着……
Everlasting_summer\Content\DialogSystem\знакомство\случилось.json,ADF927744ECE9CBCBCAD6B92E31865DB,Я не знал как поступить,我不知道该怎么办。
Everlasting_summer\Content\DialogSystem\знакомство\случилось.json,59C92E4048BCAD935BB749ABD6EF5575,"Лучше сделать что она просит, или же остаться и помочь успокоиться",是该顺着她，还是留下来陪她冷静一下。
Everlasting_summer\Content\DialogSystem\знакомство\случилось.json,2D3715664255AE318393318F91B2CAF6,"Я выбрал второй вариант, тем более, потому что чуствовал вину",我选了后者——更何况，我本来就心有愧疚。
Everlasting_summer\Content\DialogSystem\знакомство\случилось.json,0CDFE2274ACB99EF2C0CB8B4B0F138E8,"Прости меня, я поступил с тобой грубо",对不起，我之前对你太粗暴了。
Everlasting_summer\Content\DialogSystem\знакомство\случилось.json,65F642DC4328FC20178FA2885A0BEE2C,Мне не следовало так себя вести,我不应该那样做的。
Everlasting_summer\Content\DialogSystem\знакомство\случилось.json,035A32DA411D8ACC83E154B1A5FBF838,"Ты не виноват, со мной так все поступают",你没有错，大家都是这么对我的。
Everlasting_summer\Content\DialogSystem\знакомство\случилось.json,530D1F044E86085F6BAFDC9E4B1B7F0D,"Я сижу тут днями, ко мне почти не кто не заходит, и все шарахаются как от огня",我整天坐在这里，几乎没人来，大家见到我就像躲瘟疫一样绕道走。
Everlasting_summer\Content\DialogSystem\знакомство\случилось.json,214BDBA240D94D0D004B7396C85BE204,А я ведь просто хочу хотя бы одного друга,可我只是想要有一个朋友而已。
Everlasting_summer\Content\DialogSystem\знакомство\случилось.json,10E812934E265075AF80B49F6D7A3278,Не плачь пожалуйста,别哭了，好吗。
Everlasting_summer\Content\DialogSystem\знакомство\случилось.json,6665670F43C5629DC4CE658B15BB415E,Давай я буду твоим другом?,那我来做你的朋友怎么样？
Everlasting_summer\Content\DialogSystem\знакомство\случилось.json,004F1578436AEE7C73E1CA8A8D891F82,Мне не нужна дружба из жалости,我不需要出于同情的友谊。
Everlasting_summer\Content\DialogSystem\знакомство\случилось.json,82F603944EE185AF57CBD0A79E09755F,"Это не жалость, я обещаю, что буду заходить к тебе почаще",不是同情，我保证，我以后会常来找你的。
Everlasting_summer\Content\DialogSystem\знакомство\случилось.json,900923F547E32F7C13D0D68F0F818AE1,Если ты не против конечно,当然，如果你不反对的话。
Everlasting_summer\Content\DialogSystem\знакомство\случилось.json,B2AE31A94589AF95CE14B3AB33387C13,Правда?,真的吗？
Everlasting_summer\Content\DialogSystem\знакомство\случилось.json,DC735EF841A4E656D0F5F58A8756EAC1,Конечно,当然。
Everlasting_summer\Content\DialogSystem\знакомство\случилось.json,5BD254254A195FE7549BCEB26A68DB3F,Ты станешь моим другом?,你真的会成为我的朋友吗？
Everlasting_summer\Content\DialogSystem\знакомство\случилось.json,4583B358492EFEFED0CBAB923A2E1195,Да,是的。
Everlasting_summer\Content\DialogSystem\знакомство\случилось.json,E193AF224AAA7AEFA2639D8EF29F91ED,Очень тихо ответила она,她轻轻地回答了一声。
Everlasting_summer\Content\DialogSystem\знакомство\случилось.json,DEDBEDC04245740C4FD4E9BB763F179C,"Вот и хорошо, тогда я заскочу к тебе ",那就说定了，我回头来找你。
Everlasting_summer\Content\DialogSystem\знакомство\случилось.json,5112833F42C3205953CD4D95B28D7CFC,А сейчас мне нужно поискать Шурика,不过现在我得先去找一下舒里克。
Everlasting_summer\Content\DialogSystem\знакомство\случилось.json,6BE67BBB4B8044B9E536B885DBCD3309,Хорошо,好的。
